{
  "$schema": "https://json-schema.org/draft/2020-12/schema",
  "$id": "https://example.com/schemas/roadmap.schema.json",
  "title": "Roadmap",
  "type": "object",
  "required": ["schemaVersion", "id", "title", "modules"],
  "properties": {
    "schemaVersion": { "type": "integer", "const": 1 },
    "id": { "type": "string", "pattern": "^[a-zA-Z0-9_-]+$" },
    "title": { "type": "string", "minLength": 3, "maxLength": 160 },
    "description": { "type": "string", "minLength": 10, "maxLength": 5000 },
    "difficulty": { "type": "string", "enum": ["beginner","intermediate","advanced","mixed"] },
    "estimatedTotalMinutes": { "type": "integer", "minimum": 1 },
    "tags": {
      "type": "array",
      "items": { "type": "string", "minLength": 2, "maxLength": 40 },
      "maxItems": 30,
      "uniqueItems": true
    },
    "modules": {
      "type": "array",
      "minItems": 1,
      "items": {
        "type": "object",
        "required": ["id","title","order","nodeIds"],
        "properties": {
          "id": { "type": "string", "pattern": "^[a-zA-Z0-9_-]+$" },
          "title": { "type": "string", "minLength": 3, "maxLength": 160 },
            "summary": { "type": "string" },
          "order": { "type": "integer", "minimum": 0 },
          "nodeIds": {
            "type": "array",
            "items": { "type": "string", "pattern": "^[a-zA-Z0-9_-]+$" },
            "uniqueItems": true
          }
        }
      }
    },
    "nodes": {
      "type": "array",
      "minItems": 1,
      "items": {
        "type": "object",
        "required": ["id","title","moduleId","estimatedMinutes","difficulty"],
        "properties": {
          "id": { "type": "string", "pattern": "^[a-zA-Z0-9_-]+$" },
          "moduleId": { "type": "string" },
          "title": { "type": "string", "minLength": 2, "maxLength": 160 },
          "objective": { "type": "string", "maxLength": 500 },
          "contentMarkdown": { "type": "string" },
          "resources": {
            "type": "array",
            "items": {
              "type": "object",
              "required": ["type","title","url"],
              "properties": {
                "type": { "type": "string" },
                "title": { "type": "string" },
                "url": { "type": "string", "format": "uri" },
                "cost": { "type": "string" }
              }
            }
          },
          "difficulty": { "type": "string", "enum": ["beginner","intermediate","advanced"] },
          "estimatedMinutes": { "type": "integer", "minimum": 1 },
          "prereqNodeIds": {
            "type": "array",
            "items": { "type": "string" },
            "uniqueItems": true
          }
        }
      }
    }
  },
  "additionalProperties": false
}